{
  "title": "AI Innovation Hub – Team Organization (Team Matrix)",
  "organisation": "Example Bank — AI Innovation Hub",
  "method": "team-topologies",
  "rules": {
    "team_size": {
      "severity": "error",
      "min": 5,
      "max": 8,
      "count_leadership": false
    },
    "stream_ownership": {
      "severity": "error"
    },
    "stream_leadership": {
      "severity": "error",
      "required": [
        "Product Owner",
        "Tech Lead"
      ]
    },
    "chapter_lead": {
      "severity": "error"
    },
    "chapter_span": {
      "severity": "warn",
      "min_streams": 2
    },
    "required_chapters": {
      "severity": "warn",
      "chapters": []
    },
    "platform_interaction": {
      "severity": "error"
    },
    "time_boxed": {
      "severity": "error"
    },
    "max_collaborations": {
      "severity": "warn",
      "max": 2
    },
    "capability_consumed": {
      "severity": "warn"
    },
    "dunbar": {
      "severity": "warn",
      "limit": 150
    }
  },
  "chapters": [
    {
      "id": "ux",
      "name": "UX/UI Chapter",
      "scope": "Design Systems, CX, Accessibility",
      "lead": "Design Lead"
    },
    {
      "id": "agenticops",
      "name": "AgenticOps Chapter",
      "scope": "Agents, Orchestration, Guardrails",
      "lead": "GenAI Lead"
    },
    {
      "id": "data-science",
      "name": "Data Science Chapter",
      "scope": "ML, Analytics, Experimentation",
      "lead": "Principal Data Scientist"
    },
    {
      "id": "mlops",
      "name": "MLOps/LLMOps Chapter",
      "scope": "Model Lifecycle, CI/CD, Monitoring",
      "lead": "MLOps Lead"
    },
    {
      "id": "data",
      "name": "Data Chapter",
      "scope": "Data Engineering, Quality, Governance",
      "lead": "Data Architect"
    }
  ],
  "teams": [
    {
      "id": "stream-1",
      "type": "stream-aligned",
      "name": "STREAM 1",
      "short": "Wealth/Elite",
      "mission": "Wealth Management & Elite Banking AI",
      "business_stream": "Wealth & Elite Banking",
      "leadership": [
        "PO",
        "Tech Lead"
      ],
      "members": {
        "ux": 2,
        "agenticops": 2,
        "data-science": 2,
        "mlops": 1,
        "data": 1
      },
      "source": "Example — from the AI Innovation Hub team matrix"
    },
    {
      "id": "stream-2",
      "type": "stream-aligned",
      "name": "STREAM 2",
      "short": "Wholesale/IB&M",
      "mission": "Investment Banking & Markets AI",
      "business_stream": "Wholesale, Investment Banking & Markets",
      "leadership": [
        "PO",
        "Tech Lead"
      ],
      "members": {
        "ux": 1,
        "agenticops": 2,
        "data-science": 2,
        "mlops": 2,
        "data": 1
      },
      "source": "Example — from the AI Innovation Hub team matrix"
    },
    {
      "id": "stream-3",
      "type": "stream-aligned",
      "name": "STREAM 3",
      "short": "PCG & Product",
      "mission": "Private Client Group & Product AI",
      "business_stream": "Private Client Group & Product",
      "leadership": [
        "PO",
        "Tech Lead"
      ],
      "members": {
        "ux": 2,
        "agenticops": 1,
        "data-science": 2,
        "mlops": 1,
        "data": 2
      },
      "source": "Example — from the AI Innovation Hub team matrix"
    },
    {
      "id": "stream-4",
      "type": "stream-aligned",
      "name": "STREAM 4",
      "short": "CPM/Stratus",
      "mission": "Client Portfolio Management AI",
      "business_stream": "Client Portfolio Management",
      "leadership": [
        "PO",
        "Tech Lead"
      ],
      "members": {
        "ux": 1,
        "agenticops": 2,
        "data-science": 2,
        "mlops": 1,
        "data": 2
      },
      "source": "Example — from the AI Innovation Hub team matrix"
    },
    {
      "id": "stream-5",
      "type": "stream-aligned",
      "name": "STREAM 5",
      "short": "CX Intel Hub",
      "mission": "Customer Experience Intelligence",
      "business_stream": "Customer Experience Intelligence",
      "leadership": [
        "PO",
        "Tech Lead"
      ],
      "members": {
        "ux": 2,
        "agenticops": 1,
        "data-science": 2,
        "mlops": 1,
        "data": 2
      },
      "source": "Example — from the AI Innovation Hub team matrix"
    },
    {
      "id": "stream-6",
      "type": "stream-aligned",
      "name": "STREAM 6",
      "short": "Credit Engine",
      "mission": "AI Credit Scoring & Decisioning",
      "business_stream": "Credit Decisioning",
      "leadership": [
        "PO",
        "Tech Lead"
      ],
      "members": {
        "ux": 1,
        "agenticops": 1,
        "data-science": 2,
        "mlops": 2,
        "data": 2
      },
      "source": "Example — from the AI Innovation Hub team matrix"
    },
    {
      "id": "stream-7",
      "type": "stream-aligned",
      "name": "STREAM 7",
      "short": "Hyper Personalization",
      "mission": "AI Personalization & Recommendations",
      "business_stream": "Personalisation & Recommendations",
      "leadership": [
        "PO",
        "Tech Lead"
      ],
      "members": {
        "ux": 2,
        "agenticops": 1,
        "data-science": 2,
        "mlops": 1,
        "data": 2
      },
      "source": "Example — from the AI Innovation Hub team matrix"
    },
    {
      "id": "stream-8",
      "type": "stream-aligned",
      "name": "STREAM 8",
      "short": "AI Pricing Engine",
      "mission": "Dynamic Pricing & Optimization",
      "business_stream": "Pricing",
      "leadership": [
        "PO",
        "Tech Lead"
      ],
      "members": {
        "ux": 1,
        "agenticops": 1,
        "data-science": 2,
        "mlops": 2,
        "data": 2
      },
      "source": "Example — from the AI Innovation Hub team matrix"
    },
    {
      "id": "platform",
      "type": "platform",
      "name": "PLATFORM TEAM",
      "short": "Shared Services – X-as-a-Service",
      "mission": "Shared AI platform consumed self-service by every stream",
      "size": 8,
      "capabilities": [
        {
          "name": "GenAI Platform",
          "detail": "Gateway, RAG, Guardrails"
        },
        {
          "name": "Data Platform",
          "detail": "Lakehouse, Feature Store"
        },
        {
          "name": "MLOps/LLMOps Platform",
          "detail": "Registry, Pipelines, Monitoring"
        },
        {
          "name": "Infrastructure",
          "detail": "K8s, GPU, Observability"
        },
        {
          "name": "Developer Experience",
          "detail": "SDKs, Templates, Docs"
        },
        {
          "name": "Security & Controls",
          "detail": "IAM, KMS, Audit"
        }
      ]
    }
  ],
  "interactions": [
    {
      "from": "platform",
      "to": "*stream",
      "mode": "x-as-a-service",
      "purpose": "Shared services consumed self-service"
    }
  ],
  "styles": {
    "title": "text;html=1;align=center;verticalAlign=middle;fontSize=24;fontStyle=1;fontFamily=Helvetica;",
    "subtitle": "text;html=1;align=center;verticalAlign=middle;fontSize=13;fontStyle=2;fontColor=#555555;fontFamily=Helvetica;",
    "text": "text;html=1;align=left;verticalAlign=top;whiteSpace=wrap;fontSize=9;fontColor=#333333;fontFamily=Helvetica;",
    "text_center": "text;html=1;align=center;verticalAlign=middle;whiteSpace=wrap;fontSize=9;fontColor=#555555;fontFamily=Helvetica;",
    "boundary": "rounded=1;arcSize=3;dashed=1;fillColor=none;strokeColor=#333333;html=1;",
    "stream_aligned": "rounded=0;whiteSpace=wrap;html=1;fillColor=#FFFFFF;strokeColor=#6C8EBF;verticalAlign=top;",
    "stream_header": "rounded=0;whiteSpace=wrap;html=1;fillColor=#DAE8FC;strokeColor=#6C8EBF;fontStyle=1;fontSize=11;fontFamily=Helvetica;",
    "mission": "rounded=1;whiteSpace=wrap;html=1;fillColor=#DAE8FC;strokeColor=#6C8EBF;fontSize=8;fontFamily=Helvetica;",
    "chapter_rail": "rounded=0;whiteSpace=wrap;html=1;fillColor=#FFF2CC;strokeColor=#D6B656;horizontal=0;fontStyle=1;fontSize=11;fontFamily=Helvetica;",
    "chapter": "rounded=0;whiteSpace=wrap;html=1;fillColor=#FFF2CC;strokeColor=#D6B656;fontStyle=1;fontSize=11;fontFamily=Helvetica;",
    "chapter_cell": "rounded=0;whiteSpace=wrap;html=1;fillColor=#FFF2CC;strokeColor=#D6B656;fontSize=14;fontFamily=Helvetica;",
    "platform": "rounded=0;whiteSpace=wrap;html=1;fillColor=#FFFFFF;strokeColor=#82B366;verticalAlign=top;",
    "platform_header": "text;html=1;align=center;verticalAlign=middle;fontStyle=1;fontSize=12;fontFamily=Helvetica;",
    "capability": "rounded=1;whiteSpace=wrap;html=1;fillColor=#D5E8D4;strokeColor=#82B366;fontStyle=1;fontSize=10;fontFamily=Helvetica;",
    "enabling": "rounded=1;whiteSpace=wrap;html=1;fillColor=#E1D5E7;strokeColor=#9673A6;fontSize=10;fontFamily=Helvetica;",
    "complicated_subsystem": "shape=hexagon;perimeter=hexagonPerimeter2;whiteSpace=wrap;html=1;size=0.12;fillColor=#F8CECC;strokeColor=#B85450;fontSize=10;fontFamily=Helvetica;",
    "box": "rounded=0;whiteSpace=wrap;html=1;fillColor=#FFFFFF;strokeColor=#666666;verticalAlign=top;align=left;spacingLeft=10;spacingTop=6;fontSize=10;fontFamily=Helvetica;",
    "focal": "strokeColor=#B85450;strokeWidth=3;",
    "edge_x_as_a_service": "html=1;endArrow=block;endFill=1;dashed=1;strokeColor=#82B366;fontSize=10;labelBackgroundColor=#FFFFFF;",
    "edge_collaboration": "html=1;endArrow=none;strokeWidth=3;strokeColor=#9673A6;opacity=60;fontSize=10;labelBackgroundColor=#FFFFFF;",
    "edge_facilitating": "html=1;endArrow=open;dashed=1;dashPattern=1 3;strokeColor=#9673A6;fontSize=10;labelBackgroundColor=#FFFFFF;",
    "edge_plain": "html=1;rounded=0;edgeStyle=orthogonalEdgeStyle;endArrow=block;endFill=1;strokeColor=#333333;",
    "dot": "●"
  },
  "page": {
    "grid": 10
  }
}